{"$schema":"https://json-schema.org/draft/2020-12/schema","type":"object","required":["schema_version","skill_version","task","capability","employee","exact_ref","input_artifacts","allowed_context","forbidden_context","allowed_tools","forbidden_tools","expected_output","output_schema","checker","timeout","cost_budget","failure_path","rollback"],"properties":{"schema_version":{"type":"integer"},"skill_version":{"type":"string"},"task":{"type":"string"},"capability":{"type":"string"},"employee":{"type":"string"},"exact_ref":{"type":"string"},"input_artifacts":{"type":"array"},"allowed_context":{"type":"array"},"forbidden_context":{"type":"array"},"allowed_tools":{"type":"array"},"forbidden_tools":{"type":"array"},"expected_output":{"type":"string"},"output_schema":{"type":"string"},"checker":{"type":"string"},"timeout":{"type":"object"},"cost_budget":{"type":"object"},"failure_path":{"type":"string"},"rollback":{"type":"string"}}}
