{"schema_version":3,"skill_version": "4.1.0","task":"","capability":"","employee":"","exact_ref":"","input_artifacts":[],"allowed_context":[],"forbidden_context":["credentials","private review letters","unreleased manuscript"],"allowed_tools":[],"forbidden_tools":["git push","email","submission"],"expected_output":"","output_schema":"","checker":"","timeout":{"minutes":10},"cost_budget":{"tokens":null,"money":0},"failure_path":"BLOCKED","rollback":"preserve prior artifacts"}
